geo_key,locator_type,n_listings,sites,building_name,locality,address,geocode_query_hint,geocode_from_site,geocode_from_listing_id,done
A|emerald chandra layout marathahalli,address,1,housing,,"Chandra Layout, Marathahalli","emerald, Chandra Layout, Marathahalli, Bangalore East, Bengaluru","emerald, Chandra Layout, Marathahalli, Bangalore East, Bengaluru",housing,20143002,
A|bharat residency someshwara layout doddakannelli,address,1,housing,,"Someshwara Layout, Doddakannelli","Bharat residency, Someshwara Layout, Doddakannelli, Bangalore East, Bengaluru","Bharat residency, Someshwara Layout, Doddakannelli, Bangalore East, Bengaluru",housing,20144326,
A|abhay mansion veer sandra electronic city south,address,1,housing,,"Veer Sandra, Electronic City","Abhay mansion, Veer Sandra, Electronic City, South Bangalore, Bengaluru","Abhay mansion, Veer Sandra, Electronic City, South Bangalore, Bengaluru",housing,20146322,
A|swarna residency doddanekundi,address,1,housing,,"Doddanekundi, Bengaluru","Swarna residency, Doddanekundi, Bangalore East, Bengaluru","Swarna residency, Doddanekundi, Bangalore East, Bengaluru",housing,20151526,
A|8th block koramangala south,address,1,housing,,"8th Block, Koramangala","8th Block, Koramangala, South Bangalore, Bengaluru","8th Block, Koramangala, South Bangalore, Bengaluru",housing,20157034,
A|kingston springs mitganahalli north,address,1,housing,,"Mitganahalli, Bengaluru","Kingston Springs, Mitganahalli, North Bangalore, Bengaluru","Kingston Springs, Mitganahalli, North Bangalore, Bengaluru",housing,20160837,
A|durga prasad building hal 3rd stage new tippasandra,address,1,housing,,"HAL 3rd Stage, New Tippasandra","Durga Prasad building, HAL 3rd Stage, New Tippasandra, Bangalore East, Bengaluru","Durga Prasad building, HAL 3rd Stage, New Tippasandra, Bangalore East, Bengaluru",housing,20166248,
A|goodu kaverappa layout kadubeesanahalli,address,1,housing,,"Kaverappa Layout, Kadubeesanahalli","Goodu, Kaverappa Layout, Kadubeesanahalli, Bangalore East, Bengaluru","Goodu, Kaverappa Layout, Kadubeesanahalli, Bangalore East, Bengaluru",housing,20177798,
A|go green homes madeshwara venkateshwara layout s g palya south,address,1,housing,,"Venkateshwara Layout, S.G. Palya","Go Green Homes Madeshwara, Venkateshwara Layout, S.G. Palya, South Bangalore, Bengaluru","Go Green Homes Madeshwara, Venkateshwara Layout, S.G. Palya, South Bangalore, Bengaluru",housing,20178757,
A|madeshwara homes go green homes md block stage 2 btm layout 2nd stage south,address,1,housing,,"Stage 2, BTM Layout 2nd Stage","Madeshwara homes Go Green Homes MD block, Stage 2, BTM Layout 2nd Stage, South Bangalore, Bengaluru","Madeshwara homes Go Green Homes MD block, Stage 2, BTM Layout 2nd Stage, South Bangalore, Bengaluru",housing,20178858,
A|thiru k nilayam 77 inasappa layout kammanahalli,address,1,housing,,"Inasappa Layout, Kammanahalli","Thiru K Nilayam 77, Inasappa Layout, Kammanahalli, Bengaluru","Thiru K Nilayam 77, Inasappa Layout, Kammanahalli, Bengaluru",housing,20185307,
A|christ opp dada apartment venkateshwara layout s g palya south,address,1,housing,,"Venkateshwara Layout, S.G. Palya","Christ opp Dada apartment, Venkateshwara Layout, S.G. Palya, South Bangalore, Bengaluru","Christ opp Dada apartment, Venkateshwara Layout, S.G. Palya, South Bangalore, Bengaluru",housing,20186398,
A|urban solace pragathi layout doddanekundi,address,1,housing,,"Pragathi Layout, Doddanekundi","Urban solace, Pragathi Layout, Doddanekundi, Bangalore East, Bengaluru","Urban solace, Pragathi Layout, Doddanekundi, Bangalore East, Bengaluru",housing,20190466,
A|luke properties stage 3 indira nagar old madras road,address,1,housing,,"Stage 3, Indira Nagar","Luke properties, Stage 3, Indira Nagar, Old Madras Road, Bengaluru","Luke properties, Stage 3, Indira Nagar, Old Madras Road, Bengaluru",housing,20190677,
A|parappana agrahara south,address,1,housing,,"Parappana Agrahara, Bengaluru","Parappana Agrahara, South Bangalore, Bengaluru","Parappana Agrahara, South Bangalore, Bengaluru",housing,20197962,
A|vensa residency aishwarya crystal layout singasandra south,address,1,housing,,"Aishwarya Crystal Layout, Singasandra","Vensa Residency, Aishwarya Crystal Layout, Singasandra, South Bangalore, Bengaluru","Vensa Residency, Aishwarya Crystal Layout, Singasandra, South Bangalore, Bengaluru",housing,20201315,
A|lakedew residency phase 2 harlur sarjapur road,address,1,housing,,"Lakedew Residency- Phase 2, Harlur","Lakedew Residency- Phase 2, Harlur, Sarjapur Road, Bengaluru","Lakedew Residency- Phase 2, Harlur, Sarjapur Road, Bengaluru",housing,20209266,
A|p building stage 1 btm layout south,address,1,housing,,"Stage 1, BTM Layout","P building, Stage 1, BTM Layout, South Bangalore, Bengaluru","P building, Stage 1, BTM Layout, South Bangalore, Bengaluru",housing,20211885,
A|r nu bharathi layout s g palya south,address,1,housing,,"Bharathi Layout, S.G. Palya","R nu, Bharathi Layout, S.G. Palya, South Bangalore, Bengaluru","R nu, Bharathi Layout, S.G. Palya, South Bangalore, Bengaluru",housing,20218645,
A|balaji real estate ashwini layout ejipura south,address,1,housing,,"Ashwini Layout, Ejipura","Balaji Real estate, Ashwini Layout, Ejipura, South Bangalore, Bengaluru","Balaji Real estate, Ashwini Layout, Ejipura, South Bangalore, Bengaluru",housing,20229798,
A|g building venkateshwara layout s g palya south,address,1,housing,,"Venkateshwara Layout, S.G. Palya","G building, Venkateshwara Layout, S.G. Palya, South Bangalore, Bengaluru","G building, Venkateshwara Layout, S.G. Palya, South Bangalore, Bengaluru",housing,20234743,
A|g building brindavan nagar s g palya south,address,1,housing,,"Brindavan Nagar, S.G. Palya","G building, Brindavan Nagar, S.G. Palya, South Bangalore, Bengaluru","G building, Brindavan Nagar, S.G. Palya, South Bangalore, Bengaluru",housing,20234778,
A|b 10 sg venkateshwara layout s g palya south,address,1,housing,,"Venkateshwara Layout, S.G. Palya","B 10 sg, Venkateshwara Layout, S.G. Palya, South Bangalore, Bengaluru","B 10 sg, Venkateshwara Layout, S.G. Palya, South Bangalore, Bengaluru",housing,20238791,
A|m residency muthurayya swamy layout hulimavu south,address,1,housing,,"Muthurayya Swamy Layout, Hulimavu","M Residency, Muthurayya Swamy Layout, Hulimavu, South Bangalore, Bengaluru","M Residency, Muthurayya Swamy Layout, Hulimavu, South Bangalore, Bengaluru",housing,20239196,
A|cpr residency sarjapur,address,1,housing,,"Sarjapur, Bengaluru","CPR RESIDENCY, Sarjapur, Bengaluru","CPR RESIDENCY, Sarjapur, Bengaluru",housing,20242315,
A|hk residency phase i electronic city south,address,1,housing,,"Phase I, Electronic City","HK RESIDENCY, Phase I, Electronic City, South Bangalore, Bengaluru","HK RESIDENCY, Phase I, Electronic City, South Bangalore, Bengaluru",housing,20242387,
A|thyagaraja nagar basavanagudi south,address,1,housing,,"Thyagaraja Nagar, Basavanagudi","Thyagaraja Nagar, Basavanagudi, South Bangalore, Bengaluru","Thyagaraja Nagar, Basavanagudi, South Bangalore, Bengaluru",housing,20245580,
A|cozy homes 30 phase i electronic city south,address,1,housing,,"Phase I, Electronic City","Cozy Homes 30, Phase I, Electronic City, South Bangalore, Bengaluru","Cozy Homes 30, Phase I, Electronic City, South Bangalore, Bengaluru",housing,20250157,
A|garebhavipalya gb palya south,address,1,housing,,"Garebhavipalya, GB Palya","Garebhavipalya, GB Palya, South Bangalore, Bengaluru","Garebhavipalya, GB Palya, South Bangalore, Bengaluru",housing,20252362,
A|sukeerthi nest pattandur agrahara whitefield,address,1,housing,,"Pattandur Agrahara, Whitefield","Sukeerthi Nest, Pattandur Agrahara, Whitefield, Bangalore East, Bengaluru","Sukeerthi Nest, Pattandur Agrahara, Whitefield, Bangalore East, Bengaluru",housing,20259982,
A|kanaka nagar nri layout,address,1,housing,,"Kanaka Nagar, NRI Layout","Kanaka Nagar, NRI Layout, Bengaluru","Kanaka Nagar, NRI Layout, Bengaluru",housing,20272745,
A|colive boston sanjay nagar marathahalli,address,1,housing,,"Sanjay Nagar, Marathahalli","Colive Boston, Sanjay Nagar, Marathahalli, Bangalore East, Bengaluru","Colive Boston, Sanjay Nagar, Marathahalli, Bangalore East, Bengaluru",housing,20286674,
A|seven hills 1rk flats sanjay nagar marathahalli,address,1,housing,,"Sanjay Nagar, Marathahalli","Seven Hills 1rk flats, Sanjay Nagar, Marathahalli, Bangalore East, Bengaluru","Seven Hills 1rk flats, Sanjay Nagar, Marathahalli, Bangalore East, Bengaluru",housing,20288306,
A|urban solace doddanekundi,address,1,housing,,"Doddanekundi, Bengaluru","Urban Solace, Doddanekundi, Bangalore East, Bengaluru","Urban Solace, Doddanekundi, Bangalore East, Bengaluru",housing,20300409,
A|rachenahalli jakkur north,address,1,housing,,"Rachenahalli, Jakkur","Rachenahalli, Jakkur, North Bangalore, Bengaluru","Rachenahalli, Jakkur, North Bangalore, Bengaluru",housing,20313180,
A|kammanahalli,address,1,housing,,"Kammanahalli, Bengaluru","Kammanahalli, Bengaluru","Kammanahalli, Bengaluru",housing,20318618,
A|g building bharathi layout s g palya south,address,1,housing,,"Bharathi Layout, S.G. Palya","G building, Bharathi Layout, S.G. Palya, South Bangalore, Bengaluru","G building, Bharathi Layout, S.G. Palya, South Bangalore, Bengaluru",housing,20323839,
A|sg playa building bharathi layout s g palya south,address,1,housing,,"Bharathi Layout, S.G. Palya","Sg playa building, Bharathi Layout, S.G. Palya, South Bangalore, Bengaluru","Sg playa building, Bharathi Layout, S.G. Palya, South Bangalore, Bengaluru",housing,20323934,
A|rise ramagondanahalli whitefield,address,1,housing,,"Ramagondanahalli, Whitefield","Rise, Ramagondanahalli, Whitefield, Bangalore East, Bengaluru","Rise, Ramagondanahalli, Whitefield, Bangalore East, Bengaluru",housing,20329469,
A|standalone apartment panathur,address,1,housing,,"Panathur, Bengaluru","Standalone apartment, Panathur, Bangalore East, Bengaluru","Standalone apartment, Panathur, Bangalore East, Bengaluru",housing,20353087,
A|neeru enclave sanjay nagar whitefield,address,1,housing,,"Sanjay Nagar, Whitefield","neeru enclave, Sanjay Nagar, Whitefield, Bangalore East, Bengaluru","neeru enclave, Sanjay Nagar, Whitefield, Bangalore East, Bengaluru",housing,20359320,
A|sowparnika indradhanush yelachanayakanapura,address,1,housing,,"Yelachanayakanapura, Bengaluru","Sowparnika Indradhanush, Yelachanayakanapura, Bengaluru","Sowparnika Indradhanush, Yelachanayakanapura, Bengaluru",housing,20359509,
A|indiranagar eshwar layout 1 rk penthouse eshwara layout indira nagar old madras road,address,1,housing,,"Eshwara Layout, Indira Nagar","Indiranagar Eshwar layout 1 RK Penthouse, Eshwara Layout, Indira Nagar, Old Madras Road, Bengaluru","Indiranagar Eshwar layout 1 RK Penthouse, Eshwara Layout, Indira Nagar, Old Madras Road, Bengaluru",housing,20363543,
A|anil residency venkateshwara layout mahadevapura,address,1,housing,,"Venkateshwara Layout, Mahadevapura","Anil Residency, Venkateshwara Layout, Mahadevapura, Bangalore East, Bengaluru","Anil Residency, Venkateshwara Layout, Mahadevapura, Bangalore East, Bengaluru",housing,20371578,
A|1 bhk flat for rent in btm layout 1 stage near udapi garden stage 1 btm layout south,address,1,housing,,"Stage 1, BTM Layout","1 bhk flat for rent in Btm layout 1 stage near udapi garden, Stage 1, BTM Layout, South Bangalore, Bengaluru","1 bhk flat for rent in Btm layout 1 stage near udapi garden, Stage 1, BTM Layout, South Bangalore, Bengaluru",housing,20373408,
A|nyanappana halli hulimavu south,address,1,housing,,"Nyanappana Halli, Hulimavu","Nyanappana Halli, Hulimavu, South Bangalore, Bengaluru","Nyanappana Halli, Hulimavu, South Bangalore, Bengaluru",housing,20386536,
A|bharat residency adarsh palm retreat bellandur,address,1,housing,,"Adarsh Palm Retreat, Bellandur","Bharat Residency, Adarsh Palm Retreat, Bellandur, Bangalore East, Bengaluru","Bharat Residency, Adarsh Palm Retreat, Bellandur, Bangalore East, Bengaluru",housing,20387967,
A|narayana nest 1 rk punappa layout hennur north,address,1,housing,,"Punappa Layout, Hennur","Narayana nest 1 RK, Punappa Layout, Hennur, North Bangalore, Bengaluru","Narayana nest 1 RK, Punappa Layout, Hennur, North Bangalore, Bengaluru",housing,20388997,
A|ms recidency rachenahalli thanisandra north,address,1,housing,,"Rachenahalli, Thanisandra","Ms recidency, Rachenahalli, Thanisandra, North Bangalore, Bengaluru","Ms recidency, Rachenahalli, Thanisandra, North Bangalore, Bengaluru",housing,20390199,
A|vasantha suits stage 1 btm layout south,address,1,housing,,"Stage 1, BTM Layout","Vasantha Suits, Stage 1, BTM Layout, South Bangalore, Bengaluru","Vasantha Suits, Stage 1, BTM Layout, South Bangalore, Bengaluru",housing,20399571,
A|trc paradise kundalahalli brookefield,address,1,housing,,"Kundalahalli, Brookefield","TRC Paradise, Kundalahalli, Brookefield, Bangalore East, Bengaluru","TRC Paradise, Kundalahalli, Brookefield, Bangalore East, Bengaluru",housing,20399681,
A|j s antony home amrutahalli north,address,1,housing,,"Amrutahalli, Bengaluru","J S ANTONY home, Amrutahalli, North Bangalore, Bengaluru","J S ANTONY home, Amrutahalli, North Bangalore, Bengaluru",housing,20409456,
A|siddanna layout bikasipura south,address,1,housing,,"Siddanna Layout, Bikasipura","Siddanna Layout, Bikasipura, South Bangalore, Bengaluru","Siddanna Layout, Bikasipura, South Bangalore, Bengaluru",housing,20417754,
A|akshaya vana akshayanagar south,address,1,housing,,"Akshaya Vana, Akshayanagar","Akshaya Vana, Akshayanagar, South Bangalore, Bengaluru","Akshaya Vana, Akshayanagar, South Bangalore, Bengaluru",housing,20422355,
A|bullet paradise kasavanahalli,address,1,housing,,"Kasavanahalli, Bengaluru","Bullet paradise, Kasavanahalli, Bangalore East, Bengaluru","Bullet paradise, Kasavanahalli, Bangalore East, Bengaluru",housing,20425541,
A|kiran store 3rd stage old byappanahalli south,address,1,housing,,"3rd Stage, Old Byappanahalli","Kiran store, 3rd Stage, Old Byappanahalli, South Bangalore, Bengaluru","Kiran store, 3rd Stage, Old Byappanahalli, South Bangalore, Bengaluru",housing,20425820,
A|s building krishna murthi layout s g palya south,address,1,housing,,"Krishna Murthi Layout, S.G. Palya","S building, Krishna Murthi Layout, S.G. Palya, South Bangalore, Bengaluru","S building, Krishna Murthi Layout, S.G. Palya, South Bangalore, Bengaluru",housing,20426983,
A|gmb properties stage 1 btm layout south,address,1,housing,,"Stage 1, BTM Layout","Gmb Properties, Stage 1, BTM Layout, South Bangalore, Bengaluru","Gmb Properties, Stage 1, BTM Layout, South Bangalore, Bengaluru",housing,20430584,
A|regency sundar ram shetty nagar arakere south,address,1,housing,,"Sundar Ram Shetty Nagar, Arakere","Regency, Sundar Ram Shetty Nagar, Arakere, South Bangalore, Bengaluru","Regency, Sundar Ram Shetty Nagar, Arakere, South Bangalore, Bengaluru",housing,20433946,
A|doddanekundi,address,1,housing,,"Doddanekundi, Bengaluru","Doddanekundi, Bangalore East, Bengaluru","Doddanekundi, Bangalore East, Bengaluru",housing,20438095,
A|kodathi,address,1,housing,,"Kodathi, Bengaluru","Kodathi, Bangalore East, Bengaluru","Kodathi, Bangalore East, Bengaluru",housing,20441763,
A|mahsum enclave 6 block koramangala south,address,1,housing,,"6 Block, Koramangala","Mahsum Enclave, 6 Block, Koramangala, South Bangalore, Bengaluru","Mahsum Enclave, 6 Block, Koramangala, South Bangalore, Bengaluru",housing,20442566,
A|hal 2nd stage indira nagar,address,1,housing,,"HAL 2nd Stage, Indira Nagar","HAL 2nd Stage, Indira Nagar, Bengaluru","HAL 2nd Stage, Indira Nagar, Bengaluru",housing,20445231,
A|njab06 tavarekere s g palya south,address,1,housing,,"Tavarekere, S.G. Palya","NJAB06, Tavarekere, S.G. Palya, South Bangalore, Bengaluru","NJAB06, Tavarekere, S.G. Palya, South Bangalore, Bengaluru",housing,20447054,
A|sector 3 hsr layout south,address,1,housing,,"Sector 3, HSR Layout","Sector 3, HSR Layout, South Bangalore, Bengaluru","Sector 3, HSR Layout, South Bangalore, Bengaluru",housing,20447566,
A|ekta homes belur nagasandra bellandur,address,1,housing,,"Belur Nagasandra, Bellandur","Ekta Homes, Belur Nagasandra, Bellandur, Bangalore East, Bengaluru","Ekta Homes, Belur Nagasandra, Bellandur, Bangalore East, Bengaluru",housing,20448054,
A|stage 2 nagarbhavi,address,1,housing,,"Stage 2, Nagarbhavi","Stage 2, Nagarbhavi, Bangalore West, Bengaluru","Stage 2, Nagarbhavi, Bangalore West, Bengaluru",housing,20449323,
A|cs residency pragathi layout mahadevapura,address,1,housing,,"Pragathi Layout, Mahadevapura","CS RESIDENCY, Pragathi Layout, Mahadevapura, Bangalore East, Bengaluru","CS RESIDENCY, Pragathi Layout, Mahadevapura, Bangalore East, Bengaluru",housing,20453237,
A|homzye property management solutions aecs layout brookefield,address,1,housing,,"AECS Layout, Brookefield","Homzye property management solutions, AECS Layout, Brookefield, Bangalore East, Bengaluru","Homzye property management solutions, AECS Layout, Brookefield, Bangalore East, Bengaluru",housing,20453498,
A|njob21 stage 1 btm layout south,address,1,housing,,"Stage 1, BTM Layout","NJOB21, Stage 1, BTM Layout, South Bangalore, Bengaluru","NJOB21, Stage 1, BTM Layout, South Bangalore, Bengaluru",housing,20457746,
A|krishna murthi layout s g palya south,address,1,housing,,"Krishna Murthi Layout, S.G. Palya","Krishna Murthi Layout, S.G. Palya, South Bangalore, Bengaluru","Krishna Murthi Layout, S.G. Palya, South Bangalore, Bengaluru",housing,20457925,
A|pavilion sai sree layout parappana agrahara south,address,1,housing,,"Sai Sree Layout, Parappana Agrahara","Pavilion, Sai Sree Layout, Parappana Agrahara, South Bangalore, Bengaluru","Pavilion, Sai Sree Layout, Parappana Agrahara, South Bangalore, Bengaluru",housing,20458967,
A|rajajinagar central,address,1,housing,,"Rajajinagar, Bengaluru","Rajajinagar, Central Bangalore, Bengaluru","Rajajinagar, Central Bangalore, Bengaluru",housing,20460001,
A|sai homes phase 1 whitefield,address,1,housing,,"Phase 1, Whitefield","sai Homes, Phase 1, Whitefield, Bangalore East, Bengaluru","sai Homes, Phase 1, Whitefield, Bangalore East, Bengaluru",housing,20461074,
A|lakkasandra extension wilson garden central,address,1,housing,,"Lakkasandra Extension, Wilson Garden","Lakkasandra Extension, Wilson Garden, Central Bangalore, Bengaluru","Lakkasandra Extension, Wilson Garden, Central Bangalore, Bengaluru",housing,20464626,
A|on request chz villa east of ngef layout kasturi nagar,address,1,housing,,"East Of NGEF Layout, Kasturi Nagar","On request CHZ Villa, East Of NGEF Layout, Kasturi Nagar, Bangalore East, Bengaluru","On request CHZ Villa, East Of NGEF Layout, Kasturi Nagar, Bangalore East, Bengaluru",housing,20464971,
A|bhavani homes gandhi nagar munnekollal,address,1,housing,,"Gandhi Nagar, Munnekollal","Bhavani Homes, Gandhi Nagar, Munnekollal, Bangalore East, Bengaluru","Bhavani Homes, Gandhi Nagar, Munnekollal, Bangalore East, Bengaluru",housing,20469461,
A|divya sree republic of whitefield kundalahalli brookefield,address,1,housing,,"Kundalahalli, Brookefield","Divya Sree Republic Of Whitefield, Kundalahalli, Brookefield, Bangalore East, Bengaluru","Divya Sree Republic Of Whitefield, Kundalahalli, Brookefield, Bangalore East, Bengaluru",housing,20471747,
A|kaikondrahalli,address,1,housing,,"Kaikondrahalli, Bengaluru","Kaikondrahalli, Bangalore East, Bengaluru","Kaikondrahalli, Bangalore East, Bengaluru",housing,20472737,
A|prestige shantiniketan whitefield,address,1,housing,,"Whitefield, Bengaluru","Prestige Shantiniketan, Whitefield, Bangalore East, Bengaluru","Prestige Shantiniketan, Whitefield, Bangalore East, Bengaluru",housing,20484717,
A|helloworld veridian69 venugopal reddy layout arakere south,address,1,housing,,"Venugopal Reddy Layout, Arakere","HelloWorld Veridian69, Venugopal Reddy Layout, Arakere, South Bangalore, Bengaluru","HelloWorld Veridian69, Venugopal Reddy Layout, Arakere, South Bangalore, Bengaluru",housing,20484738,
A|skanda sky kaverappa layout kadubeesanahalli panathur main road panathur,address,1,housing,,"Kaverappa Layout, Kadubeesanahalli","Skanda Sky, Kaverappa Layout, Kadubeesanahalli, Panathur Main Road-Panathur, Bengaluru","Skanda Sky, Kaverappa Layout, Kadubeesanahalli, Panathur Main Road-Panathur, Bengaluru",housing,20485162,
A|rathnagiri residency stage 2 isro layout south,address,1,housing,,"Stage 2, ISRO Layout","Rathnagiri residency, Stage 2, ISRO Layout, South Bangalore, Bengaluru","Rathnagiri residency, Stage 2, ISRO Layout, South Bangalore, Bengaluru",housing,20486367,
A|elita promenade 7th phase jp nagar south,address,1,housing,,"7th Phase, JP Nagar","Elita Promenade, 7th Phase, JP Nagar, South Bangalore, Bengaluru","Elita Promenade, 7th Phase, JP Nagar, South Bangalore, Bengaluru",housing,20487294,
A|casa staya bts layout arakere south,address,1,housing,,"BTS Layout, Arakere","CASA STAYA, BTS Layout, Arakere, South Bangalore, Bengaluru","CASA STAYA, BTS Layout, Arakere, South Bangalore, Bengaluru",housing,20493417,
A|prestige parkview kadugodi industrial area,address,1,housing,,"Kadugodi Industrial Area, Bengaluru","Prestige Parkview, Kadugodi Industrial Area, Bangalore East, Bengaluru","Prestige Parkview, Kadugodi Industrial Area, Bangalore East, Bengaluru",housing,20495055,
A|seegehalli k r puram,address,1,housing,,"Seegehalli, K R Puram","Seegehalli, K R Puram, Bangalore East, Bengaluru","Seegehalli, K R Puram, Bangalore East, Bengaluru",housing,20496157,
A|felix stage 1 btm layout south,address,1,housing,,"Stage 1, BTM Layout","Felix, Stage 1, BTM Layout, South Bangalore, Bengaluru","Felix, Stage 1, BTM Layout, South Bangalore, Bengaluru",housing,20496349,
A|3rd block hbr layout north,address,1,housing,,"HBR Layout, Bengaluru","3rd Block, HBR Layout, North Bangalore, Bengaluru","3rd Block, HBR Layout, North Bangalore, Bengaluru",housing,20496475,
A|gopalan admirality court eshwara layout indira nagar old madras road,address,1,housing,,"Eshwara Layout, Indira Nagar","Gopalan Admirality Court, Eshwara Layout, Indira Nagar, Old Madras Road, Bengaluru","Gopalan Admirality Court, Eshwara Layout, Indira Nagar, Old Madras Road, Bengaluru",housing,20498138,
A|1113 8th main rd keb colony new gurappana palya 1st stage btm 1st stage 560029 btm layout,address,1,nobroker,,BTM Layout,"1113, 8th Main Rd, KEB Colony, New Gurappana Palya, 1st Stage, BTM 1st Stage, Bengaluru, Karnataka 560029, India, BTM Layout, bangalore","1113, 8th Main Rd, KEB Colony, New Gurappana Palya, 1st Stage, BTM 1st Stage, Bengaluru, Karnataka 560029, India, BTM Layout, bangalore",nobroker,8a9faf827b5dde51017b5e2064001c3d,
A|sarjapur rd near academy of pastry culinary arts school for baking culinary arts jakkasandra,address,1,nobroker,,Jakkasandra,"Sarjapur Rd near Academy of Pastry & Culinary Arts, Bangalore - School For Baking & Culinary Arts, Jakkasandra, bangalore","Sarjapur Rd near Academy of Pastry & Culinary Arts, Bangalore - School For Baking & Culinary Arts, Jakkasandra, bangalore",nobroker,ff8081816aa26aa0016aa566083b6ba6,
A|standalone building 8th block near regional passport office koramangala,address,1,nobroker,,Koramangala,"Standalone building, 8th Block near Regional Passport Office, Koramangala, bangalore","Standalone building, 8th Block near Regional Passport Office, Koramangala, bangalore",nobroker,8a9ff58287a722b40187a797cdd247df,
A|independent house hsr layout sector 7 near star market hsr layout,address,1,nobroker,,HSR LAYOUT,"Independent House, hsr layout sector 7 near star market, HSR LAYOUT, bangalore","Independent House, hsr layout sector 7 near star market, HSR LAYOUT, bangalore",nobroker,8a9f87438f4bdbd4018f4c3d03e5214b,
A|independent house near shas bakery and vivek wash tech rajiv gandhi nagar hsr layout 7th sector near new padmavathi royal homes ladies pg bommanahalli,address,1,nobroker,,Bommanahalli,"Independent House, Near Shas Bakery and Vivek wash Tech, Rajiv Gandhi Nagar HSR layout 7th Sector near New Padmavathi Royal Homes Ladies PG, Bommanahalli, bangalore","Independent House, Near Shas Bakery and Vivek wash Tech, Rajiv Gandhi Nagar HSR layout 7th Sector near New Padmavathi Royal Homes Ladies PG, Bommanahalli, bangalore",nobroker,8aa98b2d9e8ae57f019e8c486fec7308,
A|standalone building outer ring rd near bank marathahalli branch marathahalli,address,1,nobroker,,Marathahalli,"Standalone Building, Outer Ring Rd NEAR Karnataka Bank - Marathahalli Branch, Marathahalli, bangalore","Standalone Building, Outer Ring Rd NEAR Karnataka Bank - Marathahalli Branch, Marathahalli, bangalore",nobroker,8aa9a52c9ec50c49019ec67c37f33cd6,
A|independent house opposite to shell petrol bunkss layout rg halli farm road blore 66,address,1,nobroker,,Bengaluru,"Independent House, OPPOSITE TO SHELL PETROL BUNKSS LAYOUT, RG HALLI, FARM.ROAD, BLORE 66 , Bengaluru, bangalore","Independent House, OPPOSITE TO SHELL PETROL BUNKSS LAYOUT, RG HALLI, FARM.ROAD, BLORE 66 , Bengaluru, bangalore",nobroker,8a9ff282860350a001860364a0300bf3,
A|sathya sai layout near gold s gym whitefield whitefield,address,1,nobroker,,Whitefield,"Sathya Sai Layout near Gold's Gym Whitefield, Whitefield, bangalore","Sathya Sai Layout near Gold's Gym Whitefield, Whitefield, bangalore",nobroker,8a9f8c839395a21b019395b6e18b088e,
A|immadihalli near bbmp office whitefield,address,1,nobroker,Flat,Whitefield,"Immadihalli , Near BBMP Office, Whitefield, bangalore","Immadihalli , Near BBMP Office, Whitefield, bangalore",nobroker,ff8081816aca1d96016aca71b4033ba3,
A|hagadur main rd near immadihalli govt school whitefield,address,1,nobroker,Shr,Whitefield,"Hagadur Main Rd Near Immadihalli Govt School , Whitefield, bangalore","Hagadur Main Rd Near Immadihalli Govt School , Whitefield, bangalore",nobroker,8a9f8c6e71c9784f0171c9f66a791aeb,
